{
  "schemaVersion": "1.0.0",
  "verificationId": "PVV-SYNTHETIC-001",
  "candidate": {
    "candidateId": "synthetic-candidate-001",
    "artifactPath": "publication/candidate.mp4",
    "sha256": "aaaaaaaaaaaaaaaaaaaaaaaaaaaaaaaaaaaaaaaaaaaaaaaaaaaaaaaaaaaaaaaa",
    "bytes": 23,
    "sourceRevision": "synthetic-revision-001",
    "renderProvenanceId": "synthetic-render-001"
  },
  "verifier": {
    "contextId": "isolated-final-verifier-context-001",
    "readOnly": true,
    "independent": true,
    "executionReceipt": {
      "receipt": {
        "artifactPath": "execution-receipt.final-pass.json",
        "sha256": "aaaaaaaaaaaaaaaaaaaaaaaaaaaaaaaaaaaaaaaaaaaaaaaaaaaaaaaaaaaaaaaa",
        "bytes": 1
      }
    }
  },
  "preflight": {
    "artifactPath": "publication/preflight-report.json",
    "sha256": "bbbbbbbbbbbbbbbbbbbbbbbbbbbbbbbbbbbbbbbbbbbbbbbbbbbbbbbbbbbbbbbb",
    "bytes": 100
  },
  "reviewReports": [
    {
      "domain": "story-experience",
      "artifactPath": "publication/story-review.json",
      "sha256": "1111111111111111111111111111111111111111111111111111111111111111",
      "bytes": 100
    },
    {
      "domain": "screen-accuracy-compliance",
      "artifactPath": "publication/screen-review.json",
      "sha256": "2222222222222222222222222222222222222222222222222222222222222222",
      "bytes": 100
    },
    {
      "domain": "audio-captions-synchronization",
      "artifactPath": "publication/audio-review.json",
      "sha256": "3333333333333333333333333333333333333333333333333333333333333333",
      "bytes": 100
    },
    {
      "domain": "technical-frame-integrity",
      "artifactPath": "publication/technical-review.json",
      "sha256": "4444444444444444444444444444444444444444444444444444444444444444",
      "bytes": 100
    }
  ],
  "arbiterDecision": {
    "artifactPath": "publication/release-decision.json",
    "sha256": "cccccccccccccccccccccccccccccccccccccccccccccccccccccccccccccccc",
    "bytes": 100
  },
  "checks": {
    "candidateIdentity": true,
    "preflightIdentity": true,
    "reviewIdentityAndIndependence": true,
    "arbiterIdentity": true,
    "rerunPolicy": true,
    "thresholdsAndFindings": true,
    "checksumsAndProvenance": true,
    "playbackAndReproduction": true,
    "deliveryContents": true
  },
  "status": "PASS",
  "limitations": [],
  "verifiedAt": "2026-07-29T15:15:00.000Z"
}
